Main_Title,Sub_Title,Venue,Fees,Date,Links
The Complete Net Zero Emission,Innovative Approach to Achieve Complete Net Zero Comfortably,Online,"$3,950",20 - 24 Jul 2026,https://glomacs.com/training-course/the-complete-net-zero-emission
OSHA: Occupational Safety & Health Administration Standards,The Right Way for Safety,Dubai,"$5,950",20 - 24 Jul 2026,https://glomacs.com/training-course/osha-training-occupational-safety-health-administration-standards
"Oil Spills and Pollution: Prevention, Response and Recovery",,Dubai,"$5,950",20 - 24 Jul 2026,https://glomacs.com/training-course/oil-spills-and-pollution
Sustainable Urban Development,Effective Development of Urban Centers in Era of Globalization,Dubai,"$5,950",27 - 31 Jul 2026,https://glomacs.com/training-course/sustainable-urban-development
Developing and Sustaining an Effective Safety Culture,Delivering our Safety Visions and Beliefs,Istanbul,"$5,950",27 - 31 Jul 2026,https://glomacs.com/training-course/developing-and-sustaining-an-effective-safety-culture
Major Emergency Response Management,"Planning, Leadership & Communication",Dubai,"$5,950",27 - 31 Jul 2026,https://glomacs.com/training-course/major-emergency-response-management
Zero Carbon Fuels: Ammonia and Hydrogen,The Solution to Global Warming,Dubai,"$5,950",27 - 31 Jul 2026,https://glomacs.com/training-course/zero-carbon-fuels-ammonia-and-hydrogen
ISO 39001: Road Traffic Safety Management System,On the Road to ISO 39001,Dubai,"$5,950",27 - 31 Jul 2026,https://glomacs.com/training-course/iso-39001-road-traffic-safety-management-system
Aerial Surveillance,,Dubai,"$5,950",27 - 31 Jul 2026,https://glomacs.com/training-course/aerial-surveillance
Energy and Climate Change,Decarbonizing Energy Economies with Renewable Energy,Abu Dhabi,"$5,950",27 - 31 Jul 2026,https://glomacs.com/training-course/energy-climate-change
Zero Carbon Fuels: Ammonia and Hydrogen,The Solution to Global Warming,Online,"$3,950",27 - 31 Jul 2026,https://glomacs.com/training-course/zero-carbon-fuels-ammonia-and-hydrogen
IMO Model Training Course on ORPC,Level 0 - First Responders,Dubai,"$2,450",03 Aug 2026,https://glomacs.com/training-course/imo-model-training-course-on-orpc
ISGOTT & SIGTTO Requirements related to Tanker and Oil & Gas Terminal Operations and Safety,,Dubai,"$5,950",03 - 07 Aug 2026,https://glomacs.com/training-course/isgott-sigtto-requirements-related-to-tanker-and-oil-gas-terminal-operations-and-safety
Green Worker,"Mastering Green Work Strategies, Practices, and Competencies",London,"$5,950",03 - 07 Aug 2026,https://glomacs.com/training-course/green-worker
Alarm Management,The High Performance of Human Machine Interface,Dubai,"$5,950",03 - 07 Aug 2026,https://glomacs.com/training-course/alarm-management
Intelligent Felt Leadership,Leadership through Visibility — Driving Safety Culture and Team Engagement,London,"$5,950",03 - 07 Aug 2026,https://glomacs.com/training-course/intelligent-felt-leadership
Advanced Process HAZOP,Identifying Potential Hazards in Process Systems and Managing Operability Issues,London,"$5,950",03 - 07 Aug 2026,https://glomacs.com/training-course/advanced-process-hazop
Storage & Handling of Toxic Chemicals and Hazardous Materials,Effective Management and Monitoring of Safe Operating Procedures,Online,"$3,950",10 - 14 Aug 2026,https://glomacs.com/training-course/storage-handling-of-toxic-chemicals-and-hazardous-materials
"Carbon Capture, Utilization and Storage (CCUS)",Reducing Carbon Footprints through Advanced Technologies,Dubai,"$5,950",10 - 14 Aug 2026,https://glomacs.com/training-course/carbon-capture-utilization-and-storage-ccus
Storage & Handling of Toxic Chemicals and Hazardous Materials,Effective Management and Monitoring of Safe Operating Procedures,Dubai,"$5,950",10 - 14 Aug 2026,https://glomacs.com/training-course/storage-handling-of-toxic-chemicals-and-hazardous-materials
Climate Change: Economics & Governance,How Achieving the Economic Growth while Solving the Climate Change issues through Correct Governance,Dubai,"$5,950",10 - 14 Aug 2026,https://glomacs.com/training-course/climate-change-economics-governance
Safety Case Development & Application,"Excellence in Safety Case Design, Planning & Execution",London,"$5,950",10 - 14 Aug 2026,https://glomacs.com/training-course/safety-case-development-application
The Oxford Adaptive Leadership for Healthcare Management,"Improving Delegation, Managing Resources and Expectations, and Increasing Efficiency",London,"$5,950",10 - 14 Aug 2026,https://glomacs.com/training-course/the-oxford-adaptive-leadership-for-healthcare-management
"Advanced Principles in Ports & Marine Terminals Management, Operations & Safety",,Dubai,"$11,900",10 - 21 Aug 2026,https://glomacs.com/training-course/advanced-principles-in-ports-marine-terminals-management-operations-safety
Management Systems Auditor Training,"Quality, Environmental and Health & Safety Auditing",Dubai,"$5,950",17 - 21 Aug 2026,https://glomacs.com/training-course/management-systems-auditor-trainingbr-quality-environmental-and-health-and-safety-auditing
Low Carbon Development,"Empowering Sustainability: A Comprehensive Journey through Low Carbon Development Strategies, Renewable Energy, and Energy Efficiency",Dubai,"$5,950",17 - 21 Aug 2026,https://glomacs.com/training-course/low-carbon-development
Environmental and Social Impact Assessment,Better Assessment for Successful Business,London,"$5,950",17 - 21 Aug 2026,https://glomacs.com/training-course/environmental-social-impact-assessment
Management Systems Auditor Training,"Quality, Environmental and Health & Safety Auditing",Online,"$3,950",17 - 21 Aug 2026,https://glomacs.com/training-course/management-systems-auditor-trainingbr-quality-environmental-and-health-and-safety-auditing
LEED Green Associate Exam Preparation Training,Become a Leader in Green Building Design and Construction,Dubai,"$5,950",17 - 21 Aug 2026,https://glomacs.com/training-course/leed-green-associate-exam-preparation-training
IMO Model Training Course on OPRC: Level 1 - First Responders,,Dubai,"$5,950",17 - 21 Aug 2026,https://glomacs.com/training-course/imo-model-training-course-on-oprc-level-1-first-responders
Effective Management of Service Station,,Dubai,"$5,950",17 - 21 Aug 2026,https://glomacs.com/training-course/effective-management-of-service-station
Ground Safety,,Dhahran,"$5,950",24 - 28 Aug 2026,https://glomacs.com/training-course/ground-safety
Advanced Management of Environmental Service,Innovative Approaches to Environmental Service Leadership,Dubai,"$5,950",24 - 28 Aug 2026,https://glomacs.com/training-course/advance-management-of-environmental-service
Environmental Monitoring and Modelling,"Gaining Fundamental Understanding and Skills in Environmental Measurement, Modelling and Monitoring",Dubai,"$5,950",24 - 28 Aug 2026,https://glomacs.com/training-course/environmental-monitoring-and-modeling
IMO Model Training Course on OPRC: Level 3 - Senior Managers and Administrators,,Abu Dhabi,"$5,950",24 - 28 Aug 2026,https://glomacs.com/training-course/imo-model-training-course-on-oprc-level-3-senior-managers-and-administrators
Contractor Safety Management,Control Your Contractors,Dubai,"$5,950",24 - 28 Aug 2026,https://glomacs.com/training-course/contractor-safety-management
The Art of Advanced Communication for Healthcare Professionals,"Communication, Persuasion, and Influence with a Focus on Emotional Intelligence",Dubai,"$5,950",31 Aug - 04 Sep 2026,https://glomacs.com/training-course/the-art-of-advanced-communication-for-healthcare-professionals
Concrete Quality Control on Hot Climate,Project Management for the Best Quality Control of Concrete,Dubai,"$5,950",31 Aug - 04 Sep 2026,https://glomacs.com/training-course/concrete-quality-control-on-hot-climate
"Risk Assessments, Method Statements and Quality Plans",Mitigating the Consequences of Related Risk Events through Documented Control Options,London,"$5,950",31 Aug - 04 Sep 2026,https://glomacs.com/training-course/risk-assessments-method-statements-and-quality-plans
Managing Project Risks in the Oil & Gas Industry,Minimising Uncertainties in Highly Complex Environments,Dubai,"$5,950",31 Aug - 04 Sep 2026,https://glomacs.com/training-course/managing-project-risks-in-the-oil-and-gas-industry
Behavioural Based Safety,Safe Person – Safe Workplace,Riyadh,"$5,950",31 Aug - 04 Sep 2026,https://glomacs.com/training-course/behavioural-based-safety
Certified Fire Protection Specialist,Introduction to Fire Protection Principles and Practices,Dubai,"$5,950",31 Aug - 04 Sep 2026,https://glomacs.com/training-course/certified-fire-protection-specialist
Major Emergency Response Management,"Planning, Leadership & Communication",London,"$5,950",31 Aug - 04 Sep 2026,https://glomacs.com/training-course/major-emergency-response-management
The Complete Net Zero Emission,Innovative Approach to Achieve Complete Net Zero Comfortably,Dubai,"$5,950",31 Aug - 04 Sep 2026,https://glomacs.com/training-course/the-complete-net-zero-emission
Safety Technology & Risk Management,"Adopting a Systematic Approach to Risk Identification, Assessment and Management",Dubai,"$5,950",31 Aug - 04 Sep 2026,https://glomacs.com/training-course/safety-technology-and-risk-management
IMO Model Training Course on OPRC: Level 2 - Supervisors and On-Scene Commanders,,Dubai,"$5,950",07 - 11 Sep 2026,https://glomacs.com/training-course/imo-model-training-course-on-oprc-level-2-supervisors-and-on-scene-commanders
The Art of Advanced Communication for Healthcare Professionals,"Communication, Persuasion, and Influence with a Focus on Emotional Intelligence",Vienna,"$5,950",07 - 11 Sep 2026,https://glomacs.com/training-course/the-art-of-advanced-communication-for-healthcare-professionals
Safety in Process Equipment Design & Operation,Risk Minimization Approach,Dubai,"$5,950",07 - 11 Sep 2026,https://glomacs.com/training-course/safety-in-process-equipment-design-operation
Fundamentals of Decarbonisation,"Energy Efficiency, Carbon Footprint Reduction, and Climate Change Response",Dubai,"$5,950",07 - 11 Sep 2026,https://glomacs.com/training-course/fundamentals-of-decarbonisation
Safety in Process Equipment Design & Operation,Risk Minimization Approach,Online,"$3,950",07 - 11 Sep 2026,https://glomacs.com/training-course/safety-in-process-equipment-design-operation
The Oxford Adaptive Leadership for Healthcare Management,"Improving Delegation, Managing Resources and Expectations, and Increasing Efficiency",Dubai,"$5,950",14 - 18 Sep 2026,https://glomacs.com/training-course/the-oxford-adaptive-leadership-for-healthcare-management
Advanced Operation & Safety Practices in Terminals Handling Ships Carrying Liquefied Gases in Bulk,,Dubai,"$5,950",14 - 18 Sep 2026,https://glomacs.com/training-course/advanced-operation-safety-practices-in-terminals-handling-ships-carrying-liquefied-gases-in-bulk
Carbon Management,Carbon & GHG Footprinting and Net Zero Emission,Dubai,"$5,950",14 - 18 Sep 2026,https://glomacs.com/training-course/carbon-management-ghg-footprinting-net-zero-emission
Zero Carbon Fuels: Ammonia and Hydrogen,The Solution to Global Warming,London,"$5,950",14 - 18 Sep 2026,https://glomacs.com/training-course/zero-carbon-fuels-ammonia-and-hydrogen
"Oil Spills and Pollution: Prevention, Response and Recovery",,London,"$5,950",14 - 18 Sep 2026,https://glomacs.com/training-course/oil-spills-and-pollution
Process Safety Management,Improving Safety Performance,London,"$5,950",14 - 18 Sep 2026,https://glomacs.com/training-course/process-safety-management
ICS 300 Incident Command System,Understanding the Dynamics that Gives the Crisis Leader the Ability to Manage Potential Risks during Emergency Situations,Dubai,"$5,950",14 - 18 Sep 2026,https://glomacs.com/training-course/ics-300-incident-command-system
Carbon Management,Carbon & GHG Footprinting and Net Zero Emission,Online,"$3,950",14 - 18 Sep 2026,https://glomacs.com/training-course/carbon-management-ghg-footprinting-net-zero-emission
Root Cause Analysis (RCA) using Tripod Beta Method,Identify and Remove Underlying Causes of Incidents,Istanbul,"$5,950",14 - 18 Sep 2026,https://glomacs.com/training-course/root-cause-analysis-using-tripod-beta-method-incident-investigation-and-analysis
Radiation Safety,Safely Working with Radioactive Materials,Dubai,"$5,950",14 - 18 Sep 2026,https://glomacs.com/training-course/radiation-safety
Developing and Sustaining an Effective Safety Culture,Delivering our Safety Visions and Beliefs,Jeddah,"$5,950",14 - 18 Sep 2026,https://glomacs.com/training-course/developing-and-sustaining-an-effective-safety-culture
Leadership Training for HSE Compliance Officers,Developing the Next Generation of HSE Compliance Leaders,Dubai,"$5,950",14 - 18 Sep 2026,https://glomacs.com/training-course/leadership-training-for-hse-compliance-officers
Radiation Safety,Safely Working with Radioactive Materials,Online,"$3,950",14 - 18 Sep 2026,https://glomacs.com/training-course/radiation-safety
Instrumentation in Hazardous Areas,,Dubai,"$5,950",14 - 18 Sep 2026,https://glomacs.com/training-course/instrumentation-in-hazardous-areas
Behavioural Based Safety,Safe Person – Safe Workplace,Abu Dhabi,"$5,950",14 - 18 Sep 2026,https://glomacs.com/training-course/behavioural-based-safety
Energy and Climate Change,Decarbonizing Energy Economies with Renewable Energy,Dubai,"$5,950",21 - 25 Sep 2026,https://glomacs.com/training-course/energy-climate-change
Laboratory Testing and Management,Keeping Up to Date with Contemporary Testing Requirements,Dubai,"$5,950",21 - 25 Sep 2026,https://glomacs.com/training-course/laboratory-testing-and-management-keeping-up-to-date-with-contemporary-testing-requirements
Laboratory Testing and Management,Keeping Up to Date with Contemporary Testing Requirements,Online,"$3,950",21 - 25 Sep 2026,https://glomacs.com/training-course/laboratory-testing-and-management-keeping-up-to-date-with-contemporary-testing-requirements
Advanced Safety Leadership,Reducing Errors & Influencing Safety Behaviour,Amsterdam,"$5,950",21 - 25 Sep 2026,https://glomacs.com/training-course/advanced-safety-leadership
Sustainability and Carbon Accounting Masterclass,Enabling Inhouse Sustainability Report Generation,Amsterdam,"$5,950",21 - 25 Sep 2026,https://glomacs.com/training-course/sustainability-and-carbon-accounting-masterclass
Advanced Management of Environmental Service,Innovative Approaches to Environmental Service Leadership,London,"$5,950",21 - 25 Sep 2026,https://glomacs.com/training-course/advance-management-of-environmental-service
Road Safety Audits & Inspections,View the Road through the Safety Lenses,Dubai,"$5,950",21 - 25 Sep 2026,https://glomacs.com/training-course/road-safety-audits-inspections
Managing Project Risks in the Oil & Gas Industry,Minimising Uncertainties in Highly Complex Environments,Dubai,"$5,950",21 - 25 Sep 2026,https://glomacs.com/training-course/managing-project-risks-in-the-oil-and-gas-industry
Marine Reliability and Safety Management Techniques,Implementation of the Principals of Marine Safety Management leads to a Reliable Maritime Industry,Dubai,"$5,950",21 - 25 Sep 2026,https://glomacs.com/training-course/marine-reliability-and-safety-management-techniques
Managing Subcontractors,Creating the Framework for Contracting Effectiveness,London,"$5,950",21 - 25 Sep 2026,https://glomacs.com/training-course/managing-subcontractors
Road Safety Audits & Inspections,View the Road through the Safety Lenses,Online,"$3,950",21 - 25 Sep 2026,https://glomacs.com/training-course/road-safety-audits-inspections
Managing Project Risks in the Oil & Gas Industry,Minimising Uncertainties in Highly Complex Environments,Online,"$3,950",21 - 25 Sep 2026,https://glomacs.com/training-course/managing-project-risks-in-the-oil-and-gas-industry
Comprehensive SIPROTEC 5 Protection,,Dubai,"$5,950",21 - 25 Sep 2026,https://glomacs.com/training-course/comprehensive-siprotec-5-protection
IED Protection Tools and Cyber Security,Defending Against Attacks on the Power Grid,Dubai,"$5,950",21 - 25 Sep 2026,https://glomacs.com/training-course/ied-protection-tools-and-cyber-security
Mini MBA for HSE Professionals,Previously advertised as 'The 10-Day Advanced Health & Safety Leadership',Amsterdam,"$11,900",21 Sep - 02 Oct 2026,https://glomacs.com/training-course/mini-mba-for-hse-professionals
Advanced Health and Safety for Healthcare Professionals,,Amsterdam,"$5,950",28 Sep - 02 Oct 2026,https://glomacs.com/training-course/advanced-health-and-safety-for-healthcare-professionals
Circular Economy for Sustainable Built Environment,Bringing Circularity to Build Environment and Make It,Dubai,"$5,950",28 Sep - 02 Oct 2026,https://glomacs.com/training-course/circular-economy-for-sustainable-built-environment
Oil Refinery & Petrochemical Industry Wastewater Treatment,"Process Description, Design Parameters and Operation",Dubai,"$5,950",28 Sep - 02 Oct 2026,https://glomacs.com/training-course/oil-refinery-petrochemical-industry-wastewater-treatment
Accident and Injury Prevention for Petroleum Workers,"Developing Skills and Knowledge to Identify, Reduce, and Eliminate Oil and Gas-Related Hazards",Dubai,"$5,950",28 Sep - 02 Oct 2026,https://glomacs.com/training-course/accident-and-injury-prevention-for-petroleum-workers
Oil Refinery & Petrochemical Industry Wastewater Treatment,"Process Description, Design Parameters and Operation",Online,"$3,950",28 Sep - 02 Oct 2026,https://glomacs.com/training-course/oil-refinery-petrochemical-industry-wastewater-treatment
Accident and Injury Prevention for Petroleum Workers,"Developing Skills and Knowledge to Identify, Reduce, and Eliminate Oil and Gas-Related Hazards",Online,"$3,950",28 Sep - 02 Oct 2026,https://glomacs.com/training-course/accident-and-injury-prevention-for-petroleum-workers
IMO Model Training Course on OPRC: Level 3 - Senior Managers and Administrators,,London,"$5,950",28 Sep - 02 Oct 2026,https://glomacs.com/training-course/imo-model-training-course-on-oprc-level-3-senior-managers-and-administrators
Safety in Process Equipment Design & Operation,Risk Minimization Approach,Al Ain,"$5,950",28 Sep - 02 Oct 2026,https://glomacs.com/training-course/safety-in-process-equipment-design-operation
Advanced Health & Safety Management,Managing Risks to Protect People,Amsterdam,"$5,950",28 Sep - 02 Oct 2026,https://glomacs.com/training-course/advanced-health-safety-management
The Complete Net Zero Emission,Innovative Approach to Achieve Complete Net Zero Comfortably,Lisbon,"$5,950",05 - 09 Oct 2026,https://glomacs.com/training-course/the-complete-net-zero-emission
Waste Management and Circular Economy,Contemporary Approach and New Trends,Dubai,"$5,950",05 - 09 Oct 2026,https://glomacs.com/training-course/waste-management-and-circular-economy
OSHA: Occupational Safety & Health Administration Standards,The Right Way for Safety,London,"$5,950",05 - 09 Oct 2026,https://glomacs.com/training-course/osha-training-occupational-safety-health-administration-standards
Understanding Scope 3 Emissions,Approaches to address and control indirect emissions,Dubai,"$5,950",05 - 09 Oct 2026,https://glomacs.com/training-course/understanding-scope-3-emissions
Waste Management and Circular Economy,Contemporary Approach and New Trends,Online,"$3,950",05 - 09 Oct 2026,https://glomacs.com/training-course/waste-management-and-circular-economy
Alarm Management,The High Performance of Human Machine Interface,Dubai,"$5,950",05 - 09 Oct 2026,https://glomacs.com/training-course/alarm-management
Advanced Accident Investigation & Reporting,“If You Think Safety Is Expensive – Try an Accident”,Dubai,"$5,950",05 - 09 Oct 2026,https://glomacs.com/training-course/advanced-accident-investigation-reporting
Fire Fighting System Training for Operators and Technicians,,Dubai,"$5,950",05 - 09 Oct 2026,https://glomacs.com/training-course/fire-fighting-system-training-operators-and-technicians
Understanding Scope 3 Emissions,Approaches to address and control indirect emissions,Online,"$3,950",05 - 09 Oct 2026,https://glomacs.com/training-course/understanding-scope-3-emissions
Green Office Management,Improving Efficiency and Reducing Impact Through Sustainable Business Practices,Dubai,"$5,950",05 - 09 Oct 2026,https://glomacs.com/training-course/green-office-management
Advanced Accident Investigation & Reporting,“If You Think Safety Is Expensive – Try an Accident”,Online,"$3,950",05 - 09 Oct 2026,https://glomacs.com/training-course/advanced-accident-investigation-reporting
Brownfield Site Restoration and Remediation,"Technologies for Cleaning up, Redeveloping, and Planned Reuse of Brownfields and Other Contaminated Sites",London,"$5,950",12 - 16 Oct 2026,https://glomacs.com/training-course/brownfield-site-restoration-remediation
LEED Green Associate Exam Preparation Training,Become a Leader in Green Building Design and Construction,London,"$5,950",12 - 16 Oct 2026,https://glomacs.com/training-course/leed-green-associate-exam-preparation-training
Construction Quality Control on Site,A Practical Approach to Solve Construction Problems,Dubai,"$5,950",12 - 16 Oct 2026,https://glomacs.com/training-course/construction-quality-control-on-site
Hazardous Waste Management and Pollution,Contamination & Hazardous Waste - Management & Prevention,Online,"$3,950",12 - 16 Oct 2026,https://glomacs.com/training-course/hazardous-waste-management-and-pollution
Zero Carbon Fuels: Ammonia and Hydrogen,The Solution to Global Warming,Dubai,"$5,950",12 - 16 Oct 2026,https://glomacs.com/training-course/zero-carbon-fuels-ammonia-and-hydrogen
Intelligent Felt Leadership,Leadership through Visibility — Driving Safety Culture and Team Engagement,Dubai,"$5,950",12 - 16 Oct 2026,https://glomacs.com/training-course/intelligent-felt-leadership
Best Practices for Optimizing Warehouse Safety,Keeping Warehouse Workers Injury Free,Dubai,"$5,950",12 - 16 Oct 2026,https://glomacs.com/training-course/best-practices-for-optimizing-warehouse-safety
Hazardous Waste Management and Pollution,Contamination & Hazardous Waste - Management & Prevention,Dubai,"$5,950",12 - 16 Oct 2026,https://glomacs.com/training-course/hazardous-waste-management-and-pollution
Integrated Quality Management Systems (QMS) and Implementing Hazardous Waste Concepts,"Effective Implementation of ISO 9001,14001 and 45001 Standards incorporating Waste Management Principles",Dubai,"$11,900",12 - 23 Oct 2026,https://glomacs.com/training-course/integrated-quality-management-systems-qms-and-implementing-hazardous-waste-concepts
Integrated Quality Management Systems (QMS) and Implementing Hazardous Waste Concepts,"Effective Implementation of ISO 9001,14001 and 45001 Standards incorporating Waste Management Principles",Online,"$7,900",12 - 23 Oct 2026,https://glomacs.com/training-course/integrated-quality-management-systems-qms-and-implementing-hazardous-waste-concepts
The Oxford Adaptive Leadership for Healthcare Management,"Improving Delegation, Managing Resources and Expectations, and Increasing Efficiency",Amsterdam,"$5,950",19 - 23 Oct 2026,https://glomacs.com/training-course/the-oxford-adaptive-leadership-for-healthcare-management
Working at Height,"Safety, Risk Management, and Fall Protection Strategies",Dubai,"$5,950",19 - 23 Oct 2026,https://glomacs.com/training-course/working-at-height
Advanced Safety Leadership,Reducing Errors & Influencing Safety Behaviour,Dubai,"$5,950",19 - 23 Oct 2026,https://glomacs.com/training-course/advanced-safety-leadership
Safety Audit & Site Inspection,Improvement through Measurement,London,"$5,950",19 - 23 Oct 2026,https://glomacs.com/training-course/safety-audit-and-site-inspection
"Implementation of Quality, Environmental and Health & Safety Management Systems","Developing, Implementing and Assessing Management Systems for Continual Improvement of the Organisation",Dubai,"$5,950",19 - 23 Oct 2026,https://glomacs.com/training-course/implementation-of-quality-environmental-and-health-safety-management-systems
Advanced Safety Leadership,Reducing Errors & Influencing Safety Behaviour,Online,"$3,950",19 - 23 Oct 2026,https://glomacs.com/training-course/advanced-safety-leadership
"Implementation of Quality, Environmental and Health & Safety Management Systems","Developing, Implementing and Assessing Management Systems for Continual Improvement of the Organisation",Online,"$3,950",19 - 23 Oct 2026,https://glomacs.com/training-course/implementation-of-quality-environmental-and-health-safety-management-systems
Mini MBA for HSE Professionals,Previously advertised as 'The 10-Day Advanced Health & Safety Leadership',Dubai,"$11,900",19 - 30 Oct 2026,https://glomacs.com/training-course/mini-mba-for-hse-professionals
Aerial Surveillance,,Dubai,"$5,950",26 - 30 Oct 2026,https://glomacs.com/training-course/aerial-surveillance
Global Environmental Law and Governance,Challenges and Practical Solutions,Dubai,"$5,950",26 - 30 Oct 2026,https://glomacs.com/training-course/global-environmental-law-governance
IMO Model Training Course on OPRC: Level 3 - Senior Managers and Administrators,,Dubai,"$5,950",26 - 30 Oct 2026,https://glomacs.com/training-course/imo-model-training-course-on-oprc-level-3-senior-managers-and-administrators
Advanced Health & Safety Management,Managing Risks to Protect People,Dubai,"$5,950",26 - 30 Oct 2026,https://glomacs.com/training-course/advanced-health-safety-management
Advanced Health and Safety for Healthcare Professionals,,Dubai,"$5,950",26 - 30 Oct 2026,https://glomacs.com/training-course/advanced-health-and-safety-for-healthcare-professionals
Global Environmental Law and Governance,Challenges and Practical Solutions,Online,"$3,950",26 - 30 Oct 2026,https://glomacs.com/training-course/global-environmental-law-governance
Advanced Health & Safety Management,Managing Risks to Protect People,Online,"$3,950",26 - 30 Oct 2026,https://glomacs.com/training-course/advanced-health-safety-management
