Main_Title,Sub_Title,Venue,Fees,Date,Links
Advanced Health and Safety for Healthcare Professionals,,Online,"$3,950",26 - 30 Oct 2026,https://glomacs.com/training-course/advanced-health-and-safety-for-healthcare-professionals
Better Energy Management with Transition Engineering,Using Transition Engineering to Improve Energy Performance,Dubai,"$5,950",26 - 30 Oct 2026,https://glomacs.com/training-course/better-energy-management-with-transition-engineering
Advanced Process HAZOP,Identifying Potential Hazards in Process Systems and Managing Operability Issues,Dubai,"$5,950",26 - 30 Oct 2026,https://glomacs.com/training-course/advanced-process-hazop
Developing and Sustaining an Effective Safety Culture,Delivering our Safety Visions and Beliefs,Kuala Lumpur,"$5,950",26 - 30 Oct 2026,https://glomacs.com/training-course/developing-and-sustaining-an-effective-safety-culture
Advanced Process HAZOP,Identifying Potential Hazards in Process Systems and Managing Operability Issues,Online,"$3,950",26 - 30 Oct 2026,https://glomacs.com/training-course/advanced-process-hazop
Managing Subcontractors,Creating the Framework for Contracting Effectiveness,Dubai,"$5,950",02 - 06 Nov 2026,https://glomacs.com/training-course/managing-subcontractors
Traffic Accident Investigation,How to Identify and Collect Evidences,Dubai,"$5,950",02 - 06 Nov 2026,https://glomacs.com/training-course/traffic-accident-investigation
Behavioural Based Safety,Safe Person – Safe Workplace,Dubai,"$5,950",02 - 06 Nov 2026,https://glomacs.com/training-course/behavioural-based-safety
Process Safety Management,Improving Safety Performance,Nairobi,"$5,950",02 - 06 Nov 2026,https://glomacs.com/training-course/process-safety-management
Functional Safety & Cybersecurity,Safeguarding and Protecting People and Resources,Dubai,"$5,950",02 - 06 Nov 2026,https://glomacs.com/training-course/functional-safety-cybersecurity
Navigating Environmental Challenges,"Strategies for Management, Risk Assessment, Waste, and Green Practices",Dubai,"$5,950",02 - 06 Nov 2026,https://glomacs.com/training-course/navigating-environmental-challenges
"Carbon Capture, Utilization and Storage (CCUS)",Reducing Carbon Footprints through Advanced Technologies,Dubai,"$5,950",02 - 06 Nov 2026,https://glomacs.com/training-course/carbon-capture-utilization-and-storage-ccus
Business and Climate Change,Towards Net Zero Emission,Dubai,"$5,950",02 - 06 Nov 2026,https://glomacs.com/training-course/business-and-climate-change
Risk Assessment and Hazard Identification,Determining Risk Values,Dubai,"$5,950",02 - 06 Nov 2026,https://glomacs.com/training-course/risk-assessment-and-hazard-identification
IMO Model Training Course on OPRC: Level 2 - Supervisors and On-Scene Commanders,,Dubai,"$5,950",02 - 06 Nov 2026,https://glomacs.com/training-course/imo-model-training-course-on-oprc-level-2-supervisors-and-on-scene-commanders
Behavioural Based Safety,Safe Person – Safe Workplace,Online,"$3,950",02 - 06 Nov 2026,https://glomacs.com/training-course/behavioural-based-safety
Functional Safety & Cybersecurity,Safeguarding and Protecting People and Resources,Online,"$3,950",02 - 06 Nov 2026,https://glomacs.com/training-course/functional-safety-cybersecurity
"Carbon Capture, Utilization and Storage (CCUS)",Reducing Carbon Footprints through Advanced Technologies,Online,"$3,950",02 - 06 Nov 2026,https://glomacs.com/training-course/carbon-capture-utilization-and-storage-ccus
Carbon Management,Carbon & GHG Footprinting and Net Zero Emission,Amsterdam,"$5,950",02 - 06 Nov 2026,https://glomacs.com/training-course/carbon-management-ghg-footprinting-net-zero-emission
IMO Model Training Course on OPRC: Level 2 - Supervisors and On-Scene Commanders,,Online,"$3,950",02 - 06 Nov 2026,https://glomacs.com/training-course/imo-model-training-course-on-oprc-level-2-supervisors-and-on-scene-commanders
Explosive Safety Management (ESM),,Taif,"$5,950",02 - 06 Nov 2026,https://glomacs.com/training-course/explosive-safety-management-esm
Best Practices for Optimizing Warehouse Safety,Keeping Warehouse Workers Injury Free,London,"$5,950",02 - 06 Nov 2026,https://glomacs.com/training-course/best-practices-for-optimizing-warehouse-safety
IMO Model Training Course on OPRC: Level 1 - First Responders,,Abu Dhabi,"$5,950",09 - 13 Nov 2026,https://glomacs.com/training-course/imo-model-training-course-on-oprc-level-1-first-responders
Safety Audit & Site Inspection,Improvement through Measurement,Online,"$3,950",09 - 13 Nov 2026,https://glomacs.com/training-course/safety-audit-and-site-inspection
Explosive Safety Area Management (ESAM),,Taif,"$5,950",09 - 13 Nov 2026,https://glomacs.com/training-course/explosive-safety-area-management-esam
ISGOTT & SIGTTO Requirements related to Tanker and Oil & Gas Terminal Operations and Safety,,Dubai,"$5,950",09 - 13 Nov 2026,https://glomacs.com/training-course/isgott-sigtto-requirements-related-to-tanker-and-oil-gas-terminal-operations-and-safety
Sustainable Urban Development,Effective Development of Urban Centers in Era of Globalization,Dubai,"$5,950",09 - 13 Nov 2026,https://glomacs.com/training-course/sustainable-urban-development
The Oxford Adaptive Leadership for Healthcare Management,"Improving Delegation, Managing Resources and Expectations, and Increasing Efficiency",London,"$5,950",09 - 13 Nov 2026,https://glomacs.com/training-course/the-oxford-adaptive-leadership-for-healthcare-management
The Art of Advanced Communication for Healthcare Professionals,"Communication, Persuasion, and Influence with a Focus on Emotional Intelligence",Dubai,"$5,950",09 - 13 Nov 2026,https://glomacs.com/training-course/the-art-of-advanced-communication-for-healthcare-professionals
Sustainable Urban Development,Effective Development of Urban Centers in Era of Globalization,Online,"$3,950",09 - 13 Nov 2026,https://glomacs.com/training-course/sustainable-urban-development
Safety Audit & Site Inspection,Improvement through Measurement,Dubai,"$5,950",09 - 13 Nov 2026,https://glomacs.com/training-course/safety-audit-and-site-inspection
Safety Case Development & Application,"Excellence in Safety Case Design, Planning & Execution",Dubai,"$5,950",16 - 20 Nov 2026,https://glomacs.com/training-course/safety-case-development-application
Safety Technology & Risk Management,"Adopting a Systematic Approach to Risk Identification, Assessment and Management",Paris,"$5,950",16 - 20 Nov 2026,https://glomacs.com/training-course/safety-technology-and-risk-management
IMO Model Training Course on OPRC: Level 1 - First Responders,,London,"$5,950",16 - 20 Nov 2026,https://glomacs.com/training-course/imo-model-training-course-on-oprc-level-1-first-responders
"Oil Spills and Pollution: Prevention, Response and Recovery",,Kigali,"$5,950",16 - 20 Nov 2026,https://glomacs.com/training-course/oil-spills-and-pollution
"Risk Assessments, Method Statements and Quality Plans",Mitigating the Consequences of Related Risk Events through Documented Control Options,Dubai,"$5,950",16 - 20 Nov 2026,https://glomacs.com/training-course/risk-assessments-method-statements-and-quality-plans
Low Carbon Development,"Empowering Sustainability: A Comprehensive Journey through Low Carbon Development Strategies, Renewable Energy, and Energy Efficiency",Stockholm,"$5,950",16 - 20 Nov 2026,https://glomacs.com/training-course/low-carbon-development
Environmental and Social Impact Assessment,Better Assessment for Successful Business,Dubai,"$5,950",16 - 20 Nov 2026,https://glomacs.com/training-course/environmental-social-impact-assessment
"Risk Assessments, Method Statements and Quality Plans",Mitigating the Consequences of Related Risk Events through Documented Control Options,Online,"$3,950",16 - 20 Nov 2026,https://glomacs.com/training-course/risk-assessments-method-statements-and-quality-plans
Environmental Monitoring and Modelling,"Gaining Fundamental Understanding and Skills in Environmental Measurement, Modelling and Monitoring",Dubai,"$5,950",16 - 20 Nov 2026,https://glomacs.com/training-course/environmental-monitoring-and-modeling
Developing and Sustaining an Effective Safety Culture,Delivering our Safety Visions and Beliefs,Dammam,"$5,950",16 - 20 Nov 2026,https://glomacs.com/training-course/developing-and-sustaining-an-effective-safety-culture
Healthcare Hazard Control and Safety Management,Safety Excellence in Healthcare,Dubai,"$5,950",23 - 27 Nov 2026,https://glomacs.com/training-course/healthcare-hazard-control-and-safety-management
Road Safety Leadership and Management,Create a Safe Road Network,Online,"$3,950",23 - 27 Nov 2026,https://glomacs.com/training-course/road-safety-leadership-and-management
Healthcare Hazard Control and Safety Management,Safety Excellence in Healthcare,Online,"$3,950",23 - 27 Nov 2026,https://glomacs.com/training-course/healthcare-hazard-control-and-safety-management
ISO 50001: Energy Management Systems,Meeting International Standards in Energy Management,Dubai,"$5,950",23 - 27 Nov 2026,https://glomacs.com/training-course/iso-50001-energy-management-systems-meeting-international-standards-in-energy-management
Operational Safety Management for Oil & Gas Professionals,Continuing Safe Operations,Dubai,"$5,950",23 - 27 Nov 2026,https://glomacs.com/training-course/operational-safety-management-for-oil-gas-professionals
ISO 50001: Energy Management Systems,Meeting International Standards in Energy Management,Online,"$3,950",23 - 27 Nov 2026,https://glomacs.com/training-course/iso-50001-energy-management-systems-meeting-international-standards-in-energy-management
The Oxford Adaptive Leadership for Healthcare Management,"Improving Delegation, Managing Resources and Expectations, and Increasing Efficiency",Rome,"$5,950",23 - 27 Nov 2026,https://glomacs.com/training-course/the-oxford-adaptive-leadership-for-healthcare-management
Road Safety Leadership and Management,Create a Safe Road Network,Dubai,"$5,950",23 - 27 Nov 2026,https://glomacs.com/training-course/road-safety-leadership-and-management
Certified Fire Protection Specialist,Introduction to Fire Protection Principles and Practices,Dubai,"$5,950",23 - 27 Nov 2026,https://glomacs.com/training-course/certified-fire-protection-specialist
The Complete Net Zero Emission,Innovative Approach to Achieve Complete Net Zero Comfortably,London,"$5,950",30 Nov - 04 Dec 2026,https://glomacs.com/training-course/the-complete-net-zero-emission
Circular Economy for Sustainable Built Environment,Bringing Circularity to Build Environment and Make It,London,"$5,950",30 Nov - 04 Dec 2026,https://glomacs.com/training-course/circular-economy-for-sustainable-built-environment
Construction Quality Control on Site,A Practical Approach to Solve Construction Problems,Abu Dhabi,"$5,950",30 Nov - 04 Dec 2026,https://glomacs.com/training-course/construction-quality-control-on-site
Offshore Safety & Risk Management Systems,Improving Safety Increases Profits,Dubai,"$5,950",30 Nov - 04 Dec 2026,https://glomacs.com/training-course/offshore-safety-risk-management-systems
The Complete Net Zero Emission,Innovative Approach to Achieve Complete Net Zero Comfortably,Online,"$3,950",30 Nov - 04 Dec 2026,https://glomacs.com/training-course/the-complete-net-zero-emission
Leadership Training for HSE Compliance Officers,Developing the Next Generation of HSE Compliance Leaders,Dubai,"$5,950",30 Nov - 04 Dec 2026,https://glomacs.com/training-course/leadership-training-for-hse-compliance-officers
Carbon Management,Carbon & GHG Footprinting and Net Zero Emission,London,"$5,950",30 Nov - 04 Dec 2026,https://glomacs.com/training-course/carbon-management-ghg-footprinting-net-zero-emission
Road Safety Auditor Team Leader Certification,Accepting Your Leadership Potential through Your Knowledge,Dubai,"$5,950",30 Nov - 04 Dec 2026,https://glomacs.com/training-course/road-safety-auditor-team-leader-certification
Radiation Safety,Safely Working with Radioactive Materials,Dubai,"$5,950",30 Nov - 04 Dec 2026,https://glomacs.com/training-course/radiation-safety
Major Emergency Response Management,"Planning, Leadership & Communication",Dubai,"$5,950",30 Nov - 04 Dec 2026,https://glomacs.com/training-course/major-emergency-response-management
10-Day Health & Safety Development Programme,,Dubai,"$11,900",30 Nov - 11 Dec 2026,https://glomacs.com/training-course/10-day-health-safety-development-programme
Developing and Sustaining an Effective Safety Culture,Delivering our Safety Visions and Beliefs,Dubai,"$5,950",07 - 11 Dec 2026,https://glomacs.com/training-course/developing-and-sustaining-an-effective-safety-culture
Process Safety Management,Improving Safety Performance,Dubai,"$5,950",07 - 11 Dec 2026,https://glomacs.com/training-course/process-safety-management
Advanced Health and Safety for Healthcare Professionals,,Amsterdam,"$5,950",07 - 11 Dec 2026,https://glomacs.com/training-course/advanced-health-and-safety-for-healthcare-professionals
Waste Management and Circular Economy,Contemporary Approach and New Trends,London,"$5,950",07 - 11 Dec 2026,https://glomacs.com/training-course/waste-management-and-circular-economy
Root Cause Analysis (RCA) using Tripod Beta Method,Identify and Remove Underlying Causes of Incidents,Dubai,"$5,950",07 - 11 Dec 2026,https://glomacs.com/training-course/root-cause-analysis-using-tripod-beta-method-incident-investigation-and-analysis
Alarm Management,The High Performance of Human Machine Interface,Abu Dhabi,"$5,950",07 - 11 Dec 2026,https://glomacs.com/training-course/alarm-management
Advanced Health & Safety Management,Managing Risks to Protect People,Amsterdam,"$5,950",07 - 11 Dec 2026,https://glomacs.com/training-course/advanced-health-safety-management
Process Safety Management,Improving Safety Performance,Online,"$3,950",07 - 11 Dec 2026,https://glomacs.com/training-course/process-safety-management
The Oxford Adaptive Leadership for Healthcare Management,"Improving Delegation, Managing Resources and Expectations, and Increasing Efficiency",Paris,"$5,950",14 - 18 Dec 2026,https://glomacs.com/training-course/the-oxford-adaptive-leadership-for-healthcare-management
Environmental and Social Impact Assessment,Better Assessment for Successful Business,Online,"$3,950",14 - 18 Dec 2026,https://glomacs.com/training-course/environmental-social-impact-assessment
Advanced Operation & Safety Practices in Terminals Handling Ships Carrying Liquefied Gases in Bulk,,Dubai,"$5,950",14 - 18 Dec 2026,https://glomacs.com/training-course/advanced-operation-safety-practices-in-terminals-handling-ships-carrying-liquefied-gases-in-bulk
IMO Model Training Course on OPRC: Level 3 - Senior Managers and Administrators,,Dubai,"$5,950",14 - 18 Dec 2026,https://glomacs.com/training-course/imo-model-training-course-on-oprc-level-3-senior-managers-and-administrators
Construction HSE Hazards,"Site Hazardous Work, Safeguards & Controls",Dubai,"$5,950",14 - 18 Dec 2026,https://glomacs.com/training-course/construction-hse-hazards
Behavioural Based Safety,Safe Person – Safe Workplace,Dammam,"$5,950",14 - 18 Dec 2026,https://glomacs.com/training-course/behavioural-based-safety
Sustainability and Carbon Accounting Masterclass,Enabling Inhouse Sustainability Report Generation,London,"$5,950",14 - 18 Dec 2026,https://glomacs.com/training-course/sustainability-and-carbon-accounting-masterclass
Environmental and Social Impact Assessment,Better Assessment for Successful Business,Dubai,"$5,950",14 - 18 Dec 2026,https://glomacs.com/training-course/environmental-social-impact-assessment
IMO Model Training Course on OPRC: Level 2 - Supervisors and On-Scene Commanders,,Abu Dhabi,"$5,950",14 - 18 Dec 2026,https://glomacs.com/training-course/imo-model-training-course-on-oprc-level-2-supervisors-and-on-scene-commanders
IMO Model Training Course on ORPC,Level 0 - First Responders,Dubai,"$2,450",21 Dec 2026,https://glomacs.com/training-course/imo-model-training-course-on-orpc
Climate Change: Economics & Governance,How Achieving the Economic Growth while Solving the Climate Change issues through Correct Governance,Dubai,"$5,950",21 - 25 Dec 2026,https://glomacs.com/training-course/climate-change-economics-governance
ISO 39001: Road Traffic Safety Management System,On the Road to ISO 39001,Online,"$3,950",21 - 25 Dec 2026,https://glomacs.com/training-course/iso-39001-road-traffic-safety-management-system
Advanced Safety Leadership,Reducing Errors & Influencing Safety Behaviour,London,"$5,950",21 - 25 Dec 2026,https://glomacs.com/training-course/advanced-safety-leadership
Energy and Climate Change,Decarbonizing Energy Economies with Renewable Energy,Online,"$3,950",21 - 25 Dec 2026,https://glomacs.com/training-course/energy-climate-change
Traffic Accident Investigation,How to Identify and Collect Evidences,London,"$5,950",21 - 25 Dec 2026,https://glomacs.com/training-course/traffic-accident-investigation
LEED Green Associate Exam Preparation Training,Become a Leader in Green Building Design and Construction,Dubai,"$5,950",21 - 25 Dec 2026,https://glomacs.com/training-course/leed-green-associate-exam-preparation-training
OSHA: Occupational Safety & Health Administration Standards,The Right Way for Safety,Dubai,"$5,950",21 - 25 Dec 2026,https://glomacs.com/training-course/osha-training-occupational-safety-health-administration-standards
Safety Audit & Site Inspection,Improvement through Measurement,Pretoria,"$5,950",21 - 25 Dec 2026,https://glomacs.com/training-course/safety-audit-and-site-inspection
ISGOTT & SIGTTO Requirements related to Tanker and Oil & Gas Terminal Operations and Safety,,Doha,"$5,950",21 - 25 Dec 2026,https://glomacs.com/training-course/isgott-sigtto-requirements-related-to-tanker-and-oil-gas-terminal-operations-and-safety
Prevent Disastrous Decisions,Eliminating Wrong Choices,Dubai,"$5,950",21 - 25 Dec 2026,https://glomacs.com/training-course/prevent-disastrous-decisions
OSHA: Occupational Safety & Health Administration Standards,The Right Way for Safety,Online,"$3,950",21 - 25 Dec 2026,https://glomacs.com/training-course/osha-training-occupational-safety-health-administration-standards
Fundamentals of Decarbonisation,"Energy Efficiency, Carbon Footprint Reduction, and Climate Change Response",Dubai,"$5,950",21 - 25 Dec 2026,https://glomacs.com/training-course/fundamentals-of-decarbonisation
ISO 39001: Road Traffic Safety Management System,On the Road to ISO 39001,Dubai,"$5,950",21 - 25 Dec 2026,https://glomacs.com/training-course/iso-39001-road-traffic-safety-management-system
Intelligent Felt Leadership,Leadership through Visibility — Driving Safety Culture and Team Engagement,London,"$5,950",21 - 25 Dec 2026,https://glomacs.com/training-course/intelligent-felt-leadership
Mini MBA for HSE Professionals,Previously advertised as 'The 10-Day Advanced Health & Safety Leadership',London,"$11,900",21 Dec - 01 Jan 2027,https://glomacs.com/training-course/mini-mba-for-hse-professionals
IMO Model Training Course on OPRC: Level 2 - Supervisors and On-Scene Commanders,,London,"$5,950",28 Dec - 01 Jan 2027,https://glomacs.com/training-course/imo-model-training-course-on-oprc-level-2-supervisors-and-on-scene-commanders
Contractor Safety Management,Control Your Contractors,Dubai,"$5,950",28 Dec - 01 Jan 2027,https://glomacs.com/training-course/contractor-safety-management
Managing Project Risks in the Oil & Gas Industry,Minimising Uncertainties in Highly Complex Environments,Dubai,"$5,950",28 Dec - 01 Jan 2027,https://glomacs.com/training-course/managing-project-risks-in-the-oil-and-gas-industry
Safety in Process Equipment Design & Operation,Risk Minimization Approach,London,"$5,950",28 Dec - 01 Jan 2027,https://glomacs.com/training-course/safety-in-process-equipment-design-operation
The Oxford Adaptive Leadership for Healthcare Management,"Improving Delegation, Managing Resources and Expectations, and Increasing Efficiency",London,"$5,950",28 Dec - 01 Jan 2027,https://glomacs.com/training-course/the-oxford-adaptive-leadership-for-healthcare-management
ICS 300 Incident Command System,Understanding the Dynamics that Gives the Crisis Leader the Ability to Manage Potential Risks during Emergency Situations,Dubai,"$5,950",28 Dec - 01 Jan 2027,https://glomacs.com/training-course/ics-300-incident-command-system
Traffic Impact Analysis,Explore the Transportation and Land Use Interaction,Dubai,"$5,950",28 Dec - 01 Jan 2027,https://glomacs.com/training-course/traffic-impact-analysis
Advanced Health and Safety for Healthcare Professionals,,London,"$5,950",28 Dec - 01 Jan 2027,https://glomacs.com/training-course/advanced-health-and-safety-for-healthcare-professionals
The Art of Advanced Communication for Healthcare Professionals,"Communication, Persuasion, and Influence with a Focus on Emotional Intelligence",London,"$5,950",28 Dec - 01 Jan 2027,https://glomacs.com/training-course/the-art-of-advanced-communication-for-healthcare-professionals
Traffic Impact Analysis,Explore the Transportation and Land Use Interaction,Online,"$3,950",28 Dec - 01 Jan 2027,https://glomacs.com/training-course/traffic-impact-analysis
Alarm Management,The High Performance of Human Machine Interface,Dubai,"$5,950",28 Dec - 01 Jan 2027,https://glomacs.com/training-course/alarm-management
Advanced Health & Safety Management,Managing Risks to Protect People,London,"$5,950",28 Dec - 01 Jan 2027,https://glomacs.com/training-course/advanced-health-safety-management
